{"schema_version":"1.3.0","release_id":"2026-presidente-20261029T023119Z","election_id":"2026-presidente","municipio_tse":"64033","computed_at":"2026-10-29T02:31:19Z","pipeline_git_sha":"d7cf8e2f59691d9f4944a57f97626424ba92679a","method_version":"metodo-1.0.0","validation_status":"passed","section_coverage":{"sections_total":150,"sections_installed":150,"units_paired":150,"units_in_transition_analysis":150,"eligible_share_used":1,"excluded_by_reason":{},"net_change_tolerance_rule":"max(2, 1% de E1)"},"population":{"closed":134,"net_change":16,"excluded_population":0},"checks":[{"id":"harmonization.pairing_one_to_one","family":"harmonization","passed":true,"scope":"units","count_failed":0},{"id":"harmonization.section_type_stable","family":"harmonization","passed":true,"scope":"units","count_failed":0},{"id":"integrity.eligible_equals_turnout_plus_abstention","family":"integrity","passed":true,"scope":"sections","count_failed":0},{"id":"integrity.non_negative_counts","family":"integrity","passed":true,"scope":"sections","count_failed":0},{"id":"integrity.section_files_agree","family":"integrity","passed":true,"scope":"sections","count_failed":0},{"id":"integrity.turnout_equals_votes","family":"integrity","passed":true,"scope":"sections","count_failed":0},{"id":"official_totals.candidates_round_1","family":"official_totals","passed":true,"scope":"municipality","count_failed":0},{"id":"official_totals.candidates_round_2","family":"official_totals","passed":true,"scope":"municipality","count_failed":0},{"id":"official_totals.turnout_round_1","family":"official_totals","passed":true,"scope":"municipality","count_failed":0},{"id":"official_totals.turnout_round_2","family":"official_totals","passed":true,"scope":"municipality","count_failed":0}],"model":{"status":"unavailable","reason_unavailable":"A calibração por simulação não validou a estimativa para municípios com 150 ou mais seções comparáveis (este tem 150); nesta release só os limites são publicados.","methods":[],"predictive_check":null,"identified_change_share":null,"n_units_used":150,"calibration_id":"cal-2026-presidente-48bc859f"}}
