{"schema_version":"1.3.0","release_id":"2026-presidente-20261029T023119Z","election_id":"2026-presidente","municipio_tse":"61417","computed_at":"2026-10-29T02:31:19Z","pipeline_git_sha":"d7cf8e2f59691d9f4944a57f97626424ba92679a","method_version":"metodo-1.0.0","validation_status":"passed","section_coverage":{"sections_total":142,"sections_installed":142,"units_paired":142,"units_in_transition_analysis":142,"eligible_share_used":1,"excluded_by_reason":{},"net_change_tolerance_rule":"max(2, 1% de E1)"},"population":{"closed":123,"net_change":19,"excluded_population":0},"checks":[{"id":"harmonization.pairing_one_to_one","family":"harmonization","passed":true,"scope":"units","count_failed":0},{"id":"harmonization.section_type_stable","family":"harmonization","passed":true,"scope":"units","count_failed":0},{"id":"integrity.eligible_equals_turnout_plus_abstention","family":"integrity","passed":true,"scope":"sections","count_failed":0},{"id":"integrity.non_negative_counts","family":"integrity","passed":true,"scope":"sections","count_failed":0},{"id":"integrity.section_files_agree","family":"integrity","passed":true,"scope":"sections","count_failed":0},{"id":"integrity.turnout_equals_votes","family":"integrity","passed":true,"scope":"sections","count_failed":0},{"id":"official_totals.candidates_round_1","family":"official_totals","passed":true,"scope":"municipality","count_failed":0},{"id":"official_totals.candidates_round_2","family":"official_totals","passed":true,"scope":"municipality","count_failed":0},{"id":"official_totals.turnout_round_1","family":"official_totals","passed":true,"scope":"municipality","count_failed":0},{"id":"official_totals.turnout_round_2","family":"official_totals","passed":true,"scope":"municipality","count_failed":0}],"model":{"status":"failed","reason_unavailable":"dm-homog: sem convergência: R-hat máximo 1.013 (célula B>A), ESS mínimo 544","methods":[{"method_id":"dm-homog","version":"dm-homog-1.0.0","status":"failed","runtime_s":359.18,"diagnostics":{"engine":"dm-homog","units_fit":142,"grouped":false,"predicted_s":36.5,"acceptance":0.214,"rounds":6,"iterations_per_chain":600000,"phi_map":33360,"pilot_acceptance":0.273,"map_spread":0.001802,"rhat_max":1.0129,"ess_min":544,"worst_cell":"B>A","cells_checked":24,"reason":"sem convergência: R-hat máximo 1.013 (célula B>A), ESS mínimo 544"}},{"method_id":"lphom","version":"lphom-0.3.5.7","status":"ok","runtime_s":0.38,"diagnostics":{}},{"method_id":"ecolrxc","version":"ecolRxC-0.1.1.16","status":"skipped","runtime_s":0,"diagnostics":{}}],"predictive_check":null,"identified_change_share":null,"n_units_used":142,"calibration_id":"cal-2026-presidente-48bc859f"}}
