{"schema_version":"1.3.0","release_id":"2026-presidente-20261029T023119Z","election_id":"2026-presidente","municipio_tse":"63550","computed_at":"2026-10-29T02:31:19Z","pipeline_git_sha":"d7cf8e2f59691d9f4944a57f97626424ba92679a","method_version":"metodo-1.0.0","validation_status":"passed","section_coverage":{"sections_total":15,"sections_installed":15,"units_paired":15,"units_in_transition_analysis":15,"eligible_share_used":1,"excluded_by_reason":{},"net_change_tolerance_rule":"max(2, 1% de E1)"},"population":{"closed":14,"net_change":1,"excluded_population":0},"checks":[{"id":"harmonization.pairing_one_to_one","family":"harmonization","passed":true,"scope":"units","count_failed":0},{"id":"harmonization.section_type_stable","family":"harmonization","passed":true,"scope":"units","count_failed":0},{"id":"integrity.eligible_equals_turnout_plus_abstention","family":"integrity","passed":true,"scope":"sections","count_failed":0},{"id":"integrity.non_negative_counts","family":"integrity","passed":true,"scope":"sections","count_failed":0},{"id":"integrity.section_files_agree","family":"integrity","passed":true,"scope":"sections","count_failed":0},{"id":"integrity.turnout_equals_votes","family":"integrity","passed":true,"scope":"sections","count_failed":0},{"id":"official_totals.candidates_round_1","family":"official_totals","passed":true,"scope":"municipality","count_failed":0},{"id":"official_totals.candidates_round_2","family":"official_totals","passed":true,"scope":"municipality","count_failed":0},{"id":"official_totals.turnout_round_1","family":"official_totals","passed":true,"scope":"municipality","count_failed":0},{"id":"official_totals.turnout_round_2","family":"official_totals","passed":true,"scope":"municipality","count_failed":0}],"model":{"status":"ready","reason_unavailable":null,"methods":[{"method_id":"dm-homog","version":"dm-homog-1.0.0","status":"ok","runtime_s":37.72,"diagnostics":{"engine":"dm-homog","units_fit":15,"grouped":false,"predicted_s":10.1,"acceptance":0.231,"rounds":3,"iterations_per_chain":300000,"phi_map":1611,"pilot_acceptance":0.217,"map_spread":5.846e-05,"rhat_max":1.0064,"ess_min":609.1,"worst_cell":"X>A","cells_checked":20}},{"method_id":"lphom","version":"lphom-0.3.5.7","status":"ok","runtime_s":0.03,"diagnostics":{}},{"method_id":"ecolrxc","version":"ecolRxC-0.1.1.16","status":"skipped","runtime_s":0,"diagnostics":{}}],"predictive_check":{"k_folds":5,"model_error":0.03594,"null_error":0.07426,"passed":true},"identified_change_share":1,"n_units_used":15,"calibration_id":"cal-2026-presidente-48bc859f"}}
